{
  "$schema": "https://json-schema.org/draft/2020-12/schema",
  "$id": "dag/debrief.schema.json",
  "title": "Debrief (machine-checkable extract)",
  "description": "The units/<UID>/debrief.json artifact (JSON-only; no debrief.md). Gates the evidence-table plumbing (claim types drawn from references/evidence-standards.md), the budget report, and the ANSWERED 4-key socratic block (result of the pre-output self-interrogation). The executor reasons free-form in its reply, then writes this JSON; the narrative lands in the `result`/`handoff_notes` string fields.",
  "type": "object",
  "additionalProperties": false,
  "required": ["unit_id", "persona", "iteration", "result", "evidence_table", "socratic", "confidence", "footprint"],
  "properties": {
    "unit_id": { "type": "string", "pattern": "^U[0-9]{2,}$" },
    "persona": { "type": "string", "minLength": 1 },
    "iteration": { "type": "integer", "minimum": 1 },
    "result": { "type": "string", "minLength": 1 },
    "evidence_table": {
      "type": "array",
      "minItems": 1,
      "items": {
        "type": "object",
        "additionalProperties": false,
        "required": ["claim", "type", "evidence", "reproducible"],
        "properties": {
          "claim": { "type": "string", "minLength": 1 },
          "type": {
            "type": "string",
            "enum": [
              "empirical-world-fact", "code-behavior", "api-tool-contract",
              "numeric-quantitative", "causal", "design-judgment", "provenance-quote"
            ]
          },
          "evidence": { "type": "string", "minLength": 1 },
          "reproducible": { "type": "boolean" },
          "source_tier": { "type": "string", "enum": ["T-VENDOR", "T-COMM", "T-LOCAL", "T-PARAM"] },
          "retrieval_rung": { "type": "string", "enum": ["live-fetch", "vendored-docs", "cached-copy", "parametric-only"] },
          "accessed": { "type": "string", "pattern": "^[0-9]{4}-[0-9]{2}-[0-9]{2}$" },
          "vendor_silent": { "type": "boolean" },
          "vendor_surface_searched": { "type": "string", "minLength": 1 },
          "covers_owed": { "type": "array", "uniqueItems": true, "items": { "type": "string", "minLength": 1 } },
          "source_refs": { "type": "array", "uniqueItems": true, "items": { "type": "string", "pattern": "^S[0-9]+$" } },
          "extracted_premises": { "type": "array", "items": { "type": "string", "minLength": 1 } },
          "extracted_premises_none_reason": { "type": "string", "minLength": 1 }
        }
      }
    },
    "socratic": {
      "type": "object",
      "additionalProperties": true,
      "description": "CANONICAL 4-key socratic block. Result of the free-form FORK.COUNTER.ADMIT.PIVOT.RESIDUAL self-interrogation, never the dialogue itself. counter must record an OUTCOME (validator rejects blank/'n/a'; mechanical-unit sentinel = 'unit is mechanical; no material premise to break'). confidence starts high|medium|low (same vocabulary as the top-level `confidence` enum; the socratic value may add a trailing '— <uncertainty>').",
      "required": ["premise", "counter", "pivot", "confidence"],
      "properties": {
        "premise": { "type": "string", "minLength": 1 },
        "counter": { "type": "string", "minLength": 1 },
        "pivot": { "type": "string", "minLength": 1 },
        "confidence": { "type": "string", "pattern": "^(high|medium|low)\\b" },
        "horizon": {
          "type": "object",
          "additionalProperties": false,
          "description": "I49 (1.14.0, Ask 1) — OPTIONAL fifth key; the four-key `required` list above is UNCHANGED, so no archived debrief becomes invalid. Same shape as dialogues.schema.json's `horizon`. In SELF-interrogation mode there is no prior offered string to join against, so I49-3's anti-strawman join does NOT apply here and strawman detection degrades to OBSERVABLE — stated rather than claimed away.",
          "required": ["expedient", "durable", "durable_cost", "choice"],
          "properties": {
            "expedient": { "type": "string", "minLength": 1, "pattern": "\\S" },
            "durable": { "type": "string", "minLength": 1, "pattern": "\\S" },
            "durable_cost": { "type": "string", "minLength": 1, "pattern": "\\S" },
            "choice": { "type": "string", "enum": ["durable", "expedient"] },
            "debt": {
              "type": "object",
              "additionalProperties": false,
              "required": ["revisit_condition", "decisions_ref"],
              "properties": {
                "revisit_condition": { "type": "string", "minLength": 1, "pattern": "\\S" },
                "decisions_ref": { "type": "string", "minLength": 1, "pattern": "\\S" }
              }
            }
          },
          "allOf": [
            { "$comment": "I49-2 strict iff, forward half: debt REQUIRED when choice == expedient.",
              "if":   { "properties": { "choice": { "const": "expedient" } }, "required": ["choice"] },
              "then": { "required": ["debt"] } },
            { "$comment": "I49-2 strict iff, backward half: debt FORBIDDEN when choice == durable.",
              "if":   { "properties": { "choice": { "const": "durable" } }, "required": ["choice"] },
              "then": { "not": { "required": ["debt"] } } }
          ]
        }
      }
    },
    "consumed_upstream": {
      "type": "array",
      "description": "OPTIONAL. U08 RECORDING SLICE ONLY (1.14.0) — the executor declares which upstream unit outputs it ACTUALLY used: the machine-readable inverse of a citation count, authored by the CONSUMER, after the fact. NO PREDICATE READS THIS FIELD and none is intended to: the consequence-proportional-depth ESCALATION arm (I55) is DEFERRED, priced at 89.8% of the whole ten-recommendation bill, and its own verification panel ruled the price not earned. This field exists so the deferral is an ORDER TO MEASURE rather than a burial — write it for one full run, convene nothing extra, then measure the real firing rate. See references/state-machine.md 'Deferred mechanisms'.",
      "items": {
        "type": "object",
        "additionalProperties": false,
        "required": ["unit_id", "used_for"],
        "properties": {
          "unit_id": { "type": "string", "pattern": "^U[0-9]{2,}$" },
          "used_for": { "type": "string", "minLength": 1, "pattern": "\\S" },
          "artifact_ref": { "type": "string", "minLength": 1 }
        }
      }
    },
    "acceptance_self_check": {
      "type": "array",
      "items": {
        "type": "object",
        "additionalProperties": false,
        "required": ["criterion", "met"],
        "properties": {
          "criterion": { "type": "string", "minLength": 1 },
          "met": { "type": "boolean" },
          "evidence_ref": { "type": "string" }
        }
      }
    },
    "assumptions": { "type": "array", "items": { "type": "string", "minLength": 1 } },
    "residual_risks": { "type": "array", "items": { "type": "string", "minLength": 1 } },
    "confidence": { "type": "string", "enum": ["high", "medium", "low"] },
    "footprint": {
      "type": "object",
      "additionalProperties": false,
      "required": ["tokens_consumed", "within_budget"],
      "description": "Actual token usage report. within_budget is defined RELATIVE TO THIS UNIT: within_budget := (tokens_consumed <= this unit's brief.budget_tokens), NOT the global 32K (F2). tokens_consumed has NO maximum (IMP-04/PR-6): a REAL overrun must be recordable truthfully rather than forced to lie under the old maximum:32000 cap. The plan-side 32K ceiling lives on brief.budget_tokens / graph.est_footprint_tokens (untouched — you still cannot PLAN >32K). validate_run.py I5 FAILs a tokens_consumed > brief.budget_tokens paired with within_budget:true. The if/then below is a coarser schema-only backstop (a schema cannot read the per-unit brief.budget_tokens): any report of tokens_consumed>32000 MUST ALSO self-identify as over-budget (within_budget:false), so the re-atomization discipline (SKILL.md Scope note) consumes an honest signal.",
      "properties": {
        "tokens_consumed": { "type": "integer", "minimum": 0 },
        "within_budget": { "type": "boolean" }
      },
      "if": {
        "required": ["tokens_consumed"],
        "properties": { "tokens_consumed": { "exclusiveMinimum": 32000 } }
      },
      "then": {
        "properties": { "within_budget": { "const": false } }
      }
    },
    "handoff_notes": { "type": "array", "items": { "type": "string", "minLength": 1 } },
    "prior_feedback": {
      "type": "object",
      "additionalProperties": true,
      "description": "Retries only (iteration>1): verbatim echo of iteration n-1's verify.feedback (actionable_changes + do_not_touch) plus >=1 concrete change made in response (AO-6). Home for what was formerly the debrief.md 'Prior feedback' section under JSON-only artifacts. On a retry the presence + non-empty changes_made + do_not_touch echo are now SCHEMA-REQUIRED (see the allOf clause below — IMP-05/PR-6); the echo's CONTENT stays executor-attested.",
      "properties": {
        "actionable_changes": { "type": "array", "items": { "type": "string" } },
        "do_not_touch": { "type": "array", "items": { "type": "string" } },
        "changes_made": { "type": "array", "items": { "type": "string" } }
      }
    },
    "case_set_discharge": {
      "type": "array",
      "description": "OPTIONAL. The per-entry discharge record for the brief's case_set[] (case_set contract SPEC.md section 3). One row per frozen brief entry (origin 'orchestrator'), plus any entry the executor ADDed (origin 'executor') - this array is the ONLY home for an added entry (D13b); there is no addendum file and no brief amendment. Per row it records whether every required observation was made and every forbidden observation was demonstrated absent (outcome), and the non-vacuity result where one applies (non_vacuity, discharged-only). Totality over the frozen brief and the tier floor are adjudicated OFFLINE by verify.case_set_audit.discharge_check, not by this schema (a schema cannot read the sibling brief).",
      "items": {
        "type": "object",
        "additionalProperties": false,
        "required": ["id", "origin", "outcome", "evidence", "evidence_tier"],
        "properties": {
          "id": { "type": "string", "minLength": 1 },
          "origin": { "type": "string", "enum": ["orchestrator", "executor"] },
          "outcome": { "type": "string", "enum": ["discharged", "violated", "infeasible", "vacuous"] },
          "evidence": { "type": "string", "minLength": 1 },
          "evidence_tier": { "type": "string", "enum": ["executable", "located", "asserted"] },
          "asserted_reason": { "type": "string", "minLength": 1, "pattern": "\\S" },
          "non_vacuity": {
            "type": "array",
            "minItems": 1,
            "description": "SPEC section 3.2: one member per observation. On a discharged row the multiset of observation_ref values MUST equal, byte for byte, the entry's required_observations UNION forbidden_observations - a CROSS-ARTIFACT check for an orchestrator row (the lists live only in the brief), so it is adjudicated offline, not here.",
            "items": {
              "type": "object",
              "additionalProperties": false,
              "required": ["observation_ref", "counterfactual", "counterfactual_result"],
              "properties": {
                "observation_ref": { "type": "string", "minLength": 1 },
                "counterfactual": { "type": "string", "minLength": 1 },
                "counterfactual_result": { "type": "string", "enum": ["red", "not-run"] },
                "reason": { "type": "string", "minLength": 1, "pattern": "\\S" }
              },
              "allOf": [
                { "$comment": "reason REQUIRED exactly when counterfactual_result is 'not-run'; MUST be absent when 'red'. The `pattern: \\S` bar above is load-bearing: a bare minLength:1 let a single space satisfy it, which is what made 'not-run' cost one keystroke.",
                  "if": { "required": ["counterfactual_result"], "properties": { "counterfactual_result": { "const": "not-run" } } },
                  "then": { "required": ["reason"] },
                  "else": { "not": { "required": ["reason"] } } }
              ]
            }
          },
          "infeasible_reason": { "type": "string", "minLength": 1, "pattern": "\\S" },
          "vacuity_finding": { "type": "string", "minLength": 1, "pattern": "\\S" },
          "check": { "type": "string", "minLength": 1 },
          "check_form": { "type": "string", "enum": ["command", "locator"] },
          "trigger_ref": { "type": "string", "minLength": 1 },
          "requirement_ref": { "type": "string", "minLength": 1 },
          "requirement_ref_none_reason": { "type": "string", "minLength": 1, "pattern": "\\S" },
          "required_observations": { "type": "array", "minItems": 1, "items": { "type": "string", "minLength": 1 } },
          "forbidden_observations": { "type": "array", "items": { "type": "string", "minLength": 1 } },
          "forbidden_observations_none_reason": { "type": "string", "minLength": 1, "pattern": "\\S" },
          "production_path": { "type": "boolean" },
          "production_path_none_reason": { "type": "string", "minLength": 1, "pattern": "\\S" }
        },
        "allOf": [
          { "$comment": "SPEC section 3.1: the id is a CONDITIONAL on origin, in the if/then idiom - an orchestrator row cites the frozen brief id verbatim (^C[0-9]+$), an executor ADD carries its own (^CX[0-9]+$). Prefix/origin disagreement is a FAIL.",
            "if": { "required": ["origin"], "properties": { "origin": { "const": "orchestrator" } } },
            "then": { "properties": { "id": { "pattern": "^C[0-9]+$" } } },
            "else": { "properties": { "id": { "pattern": "^CX[0-9]+$" } } } },
          { "$comment": "SPEC section 3.1: for an orchestrator entry the section-2.1 fields live in the frozen brief; re-stating them here creates a second copy that can be quietly narrowed - that is how 'never shrink' is violated without leaving a trace. So they MUST be absent on an orchestrator row and REQUIRED on an executor ADD (each under its own section-2.1 condition; the none-reason companions stay conditional below).",
            "if": { "required": ["origin"], "properties": { "origin": { "const": "orchestrator" } } },
            "then": { "allOf": [
              { "not": { "required": ["check"] } }, { "not": { "required": ["check_form"] } },
              { "not": { "required": ["trigger_ref"] } }, { "not": { "required": ["requirement_ref"] } },
              { "not": { "required": ["requirement_ref_none_reason"] } },
              { "not": { "required": ["required_observations"] } },
              { "not": { "required": ["forbidden_observations"] } },
              { "not": { "required": ["forbidden_observations_none_reason"] } },
              { "not": { "required": ["production_path"] } },
              { "not": { "required": ["production_path_none_reason"] } }
            ] },
            "else": { "required": ["check", "check_form", "trigger_ref", "required_observations", "forbidden_observations", "production_path"] } },
          { "$comment": "SPEC section 3.2: non_vacuity is REQUIRED when outcome is 'discharged' and MUST be absent otherwise (it is discharged-only, which is why vacuity_finding is the only field carrying the vacuity result).",
            "if": { "required": ["outcome"], "properties": { "outcome": { "const": "discharged" } } },
            "then": { "required": ["non_vacuity"] },
            "else": { "not": { "required": ["non_vacuity"] } } },
          { "$comment": "SPEC section 3.1: infeasible_reason REQUIRED when outcome is 'infeasible'; MUST be absent otherwise. Silence here is the 'dropped it silently' failure DoD 2 forbids.",
            "if": { "required": ["outcome"], "properties": { "outcome": { "const": "infeasible" } } },
            "then": { "required": ["infeasible_reason"] },
            "else": { "not": { "required": ["infeasible_reason"] } } },
          { "$comment": "SPEC section 3.1: vacuity_finding REQUIRED exactly when outcome is 'vacuous'; MUST be absent otherwise. Decidable from wire values alone - one key, one value, no inference about which of several causes applied.",
            "if": { "required": ["outcome"], "properties": { "outcome": { "const": "vacuous" } } },
            "then": { "required": ["vacuity_finding"] },
            "else": { "not": { "required": ["vacuity_finding"] } } },
          { "$comment": "SPEC section 3.1: asserted_reason REQUIRED when evidence_tier is 'asserted'; MUST be absent otherwise. Symmetric with infeasible_reason - the iteration-1 asymmetry was the cheapest route to a fully green, fully evidence-free case set.",
            "if": { "required": ["evidence_tier"], "properties": { "evidence_tier": { "const": "asserted" } } },
            "then": { "required": ["asserted_reason"] },
            "else": { "not": { "required": ["asserted_reason"] } } },
          { "$comment": "SPEC section 2.1: exactly one of requirement_ref / requirement_ref_none_reason on an entry that carries either - never both.",
            "if": { "required": ["requirement_ref"] },
            "then": { "not": { "required": ["requirement_ref_none_reason"] } } },
          { "$comment": "SPEC section 2.1 (I21 explicit-none): an executor ADD with an empty forbidden_observations owes the none-reason, whose content test names the clauses searched for in the requirement_ref text.",
            "if": { "required": ["forbidden_observations"], "properties": { "forbidden_observations": { "maxItems": 0 } } },
            "then": { "required": ["forbidden_observations_none_reason"] } },
          { "$comment": "SPEC section 2.1: production_path false must be a DECISION, not a default - it owes the none-reason naming why the requirement has no consumer surface.",
            "if": { "required": ["production_path"], "properties": { "production_path": { "const": false } } },
            "then": { "required": ["production_path_none_reason"] } }
        ]
      }
    }
  },
  "allOf": [
    {
      "description": "Retry echo mandatory (IMP-05/PR-6). A retry (iteration>=2) MUST carry the prior_feedback echo, and that echo MUST record >=1 concrete change (changes_made non-empty, AO-6) plus the do_not_touch echo field (present; may be [] for an honest 'nothing passed yet', AO-2). Closes the 'evasion by omission' half of Limitation F (I14/I15 were presence-gated: a retry omitting the whole block skipped both checks). A schema-invalid retry debrief is dropped before the I14/I15 comparison, so this is now the load-bearing presence gate; I14/I15 remain as the semantic backstop over schema-valid retries. First attempts (iteration:1) are untouched.",
      "if": {
        "required": ["iteration"],
        "properties": { "iteration": { "minimum": 2 } }
      },
      "then": {
        "required": ["prior_feedback"],
        "properties": {
          "prior_feedback": {
            "required": ["changes_made", "do_not_touch"],
            "properties": {
              "changes_made": { "type": "array", "minItems": 1 }
            }
          }
        }
      }
    }
  ]
}
