{
  "unit_id": "U01",
  "persona": "Researcher",
  "iteration": 2,
  "prior_feedback": {
    "actionable_changes": [
      "tighten the wording on the single search-summary-level figure so it reads as a disclosed residual, not a primary-sourced claim"
    ],
    "do_not_touch": [
      "the maker!=checker mandate framing",
      "the disclosed search-summary caveat"
    ],
    "changes_made": [
      "re-resolved every cited locator to a dated primary source and explicitly disclosed the single search-summary figure as a residual risk"
    ]
  },
  "result": "13 findings across 5 areas, each with a dated primary source.",
  "evidence_table": [
    {
      "claim": "Orchestrator-worker +90.2% but 15x tokens",
      "type": "empirical-world-fact",
      "evidence": "anthropic.com/engineering/multi-agent-research-system (WebFetched 2026-07-03)",
      "reproducible": true
    },
    {
      "claim": "Constrained decoding guarantees schema-valid I/O",
      "type": "empirical-world-fact",
      "evidence": "arXiv:2501.10868",
      "reproducible": true
    }
  ],
  "socratic": {
    "premise": "13 findings, each with a dated primary source, satisfy the research acceptance criteria.",
    "counter": "Sought a criterion left unsupported by a primary source; none found - every finding resolves to a dated source, so the premise HOLDS.",
    "pivot": "If any headline figure traced only to a search summary rather than a dated primary source, the 'each with a dated primary source' claim would flip.",
    "confidence": "high - one figure is search-summary level, disclosed as a residual risk.",
    "horizon": {
      "expedient": "Ship the narrow fix now and revisit the general case later.",
      "durable": "Rewrite the whole path so the general case is handled once.",
      "durable_cost": "One extra wave and a schema migration.",
      "choice": "expedient",
      "debt": {
        "revisit_condition": "Revisit when the second consumer lands.",
        "decisions_ref": "DECISIONS.md#D99-no-such-anchor"
      }
    }
  },
  "acceptance_self_check": [
    {
      "criterion": "10-14 findings",
      "met": true,
      "evidence_ref": "row 1-13"
    }
  ],
  "assumptions": [
    "search-result listing counts as verified existence"
  ],
  "residual_risks": [
    "some numeric figures from search summaries, not primary PDF"
  ],
  "confidence": "high",
  "footprint": {
    "tokens_consumed": 21000,
    "within_budget": true
  },
  "handoff_notes": [
    "Decouple maker from checker is the strongest single mandate"
  ],
  "case_set_discharge": [
    {
      "id": "C1",
      "origin": "orchestrator",
      "outcome": "discharged",
      "evidence": "ran the C1 check against units/U01/debrief.json and recorded its stdout",
      "evidence_tier": "executable",
      "non_vacuity": [
        {
          "observation_ref": "the finding count is reported and is inside the 10-14 band",
          "counterfactual": "deleted one evidence_table row and re-ran the C1 check: the printed count changed, so the check reads the rows and is not a constant",
          "counterfactual_result": "red"
        },
        {
          "observation_ref": "a count read off the prose result line instead of counted from evidence_table[]",
          "counterfactual": "rewrote the check to measure the prose 'result' string instead of evidence_table[]: the count stopped tracking the rows, so the forbidden read is distinguishable",
          "counterfactual_result": "red"
        }
      ]
    },
    {
      "id": "C2",
      "origin": "orchestrator",
      "outcome": "discharged",
      "evidence": "ran the C2 check against units/U01/debrief.json and recorded its stdout",
      "evidence_tier": "executable",
      "non_vacuity": [
        {
          "observation_ref": "every evidence_table row carries a dated primary source",
          "counterfactual": "blanked the year out of one evidence_table row's evidence string and re-ran the C2 check: it flipped to False, so the check observes the dates",
          "counterfactual_result": "red"
        },
        {
          "observation_ref": "a row whose evidence resolves only to a search summary and is counted as primary",
          "counterfactual": "replaced one row's evidence with a bare search-summary string carrying a year and re-ran the C2 check: it stayed True, which is exactly the forbidden read, so this observation needs its own counterfactual",
          "counterfactual_result": "red"
        }
      ]
    }
  ]
}
