{
  "unit_id": "U01",
  "persona": "Researcher",
  "iteration": 1,
  "result": "I32 (b) negative: C2 is covered by an ASSUMPTION-labeled, confidence-capped parametric fallback, but the debrief's residual_risks[] does NOT name that owed claim - the sole RL-2 clause this fixture trips (RT-8 presence).",
  "evidence_table": [
    {
      "claim": "The validator rejects a covered owed row whose evidence omits the id in covers_owed",
      "type": "code-behavior",
      "evidence": "validate_run.py I30 clause 2 fabricated-coverage FAIL; README.md:12",
      "reproducible": true,
      "covers_owed": [
        "C1"
      ],
      "source_tier": "T-LOCAL",
      "source_refs": [
        "S1"
      ]
    },
    {
      "claim": "The documented default figure, recalled parametrically (R0-R2 vendor surface unreachable this run)",
      "type": "empirical-world-fact",
      "evidence": "ASSUMPTION: parametric recall of the documented default; live-fetch and vendored-docs both unavailable this run",
      "reproducible": true,
      "covers_owed": [
        "C2"
      ],
      "source_tier": "T-PARAM",
      "retrieval_rung": "parametric-only"
    }
  ],
  "socratic": {
    "premise": "Both owed claims are discharged by a linked evidence row at the highest reachable tier.",
    "counter": "Sought an owed id with no covering row or a tier the row cannot satisfy; found none - C1 maps to the T-LOCAL row and C2 to the parametric fallback, so the premise HOLDS (C2 confidence-capped).",
    "pivot": "Had the vendor surface been reachable, C2 would move off the parametric fallback to a covered (not downgraded) status.",
    "confidence": "medium - one claim rests on a disclosed parametric fallback."
  },
  "acceptance_self_check": [
    {
      "criterion": "10-14 findings",
      "met": true,
      "evidence_ref": "rows 0-1"
    }
  ],
  "assumptions": [
    "parametric recall of the documented default is acceptable at a confidence-capped level"
  ],
  "residual_risks": [
    "coverage rests partly on a disclosed parametric fallback; re-fetch when the vendor surface is reachable"
  ],
  "confidence": "medium",
  "footprint": {
    "tokens_consumed": 21000,
    "within_budget": true
  },
  "handoff_notes": [
    "the downgraded coverage should be re-fetched from the vendor doc when the surface is reachable"
  ]
}
